{
  "schemaVersion": 1,
  "releaseId": "elizaos-android-example-2026.05.0",
  "generatedAt": "2026-05-15T00:00:00Z",
  "buildFingerprint": "elizaOS/eliza_tegu_phone/tegu:15/example:userdebug/test-keys",
  "buildType": "userdebug",
  "supportedDevices": [
    {
      "targetId": "pixel9a-tegu",
      "codename": "tegu",
      "marketingName": "Pixel 9a",
      "tier": "candidate",
      "slots": ["a", "b"],
      "dynamicPartitions": true,
      "rollbackSupported": true,
      "notes": "Example only. Promote after a real lab flash and validation pass."
    }
  ],
  "artifacts": [
    {
      "partition": "boot",
      "filename": "boot.img",
      "sha256": "adc7cf0cbb58ab51520a1fa874a80fb0735a4464fd9b1988096761b4c11d8677",
      "sizeBytes": 19,
      "required": true,
      "fastbootMode": "bootloader"
    },
    {
      "partition": "vendor_boot",
      "filename": "vendor_boot.img",
      "sha256": "dbbb45447bdde07766a48c299ade9573b28bb45c2a81db370ddb3516e95e03ab",
      "sizeBytes": 26,
      "required": true,
      "fastbootMode": "bootloader"
    },
    {
      "partition": "super",
      "filename": "super.img",
      "sha256": "fb5500dfc6572b380682d824fb84662cfd39c8bb834e5604f3d4772462987628",
      "sizeBytes": 20,
      "required": true,
      "fastbootMode": "fastbootd"
    }
  ],
  "validation": {
    "bootTimeoutSeconds": 300,
    "expectedFingerprintPrefix": "elizaOS/eliza_tegu_phone/tegu:",
    "properties": {
      "ro.product.device": "tegu",
      "sys.boot_completed": "1",
      "pm_path": "package:/system/priv-app/Eliza/Eliza.apk",
      "home_role": "ai.elizaos.app",
      "foreground_activity": "ai.elizaos.app/.MainActivity",
      "agent_service_pid": "present",
      "agent_health": "GET /api/health HTTP 200 ready",
      "logcat_fatal_count": "0",
      "selinux_avc_denied_count": "0"
    },
    "requiredValidationTokens": [
      "pm path",
      "cmd role holders",
      "foreground",
      "service",
      "/api/health",
      "logcat",
      "selinux"
    ]
  },
  "rollback": {
    "previousReleaseId": "stock-or-previous-known-good",
    "notes": "Keep previous known-good artifacts available before flashing."
  }
}
